{"artifact":"okf-source-bundle","diagnostics":[],"documents":[{"body":"# Index\n","byte_length":8,"casefold":{"tags":[],"text":"index\n# index\n","type":"component"},"frontmatter":{"title":"Index","type":"Component"},"links":[],"path":"index.md","sha256":"1111111111111111111111111111111111111111111111111111111111111111","state":"current"}],"known_paths":["index.md"],"producer":{"implementation_sha256":"2222222222222222222222222222222222222222222222222222222222222222","name":"fuzz-parser","runtime":"fixture","version":"1"},"schema_version":1}
